{
  "principal_id": "bbda2995-3a2e-5e3c-90a2-72a4373f960f",
  "trade_name": "Mangal Wholesale",
  "verification_status": "demo_verified",
  "coverage": [
    "Pune",
    "Maharashtra"
  ],
  "delivery_days": 3,
  "credit_days": [
    7,
    15
  ],
  "available_sku_count": 40,
  "reliability_score": null,
  "reliability_evidence_count": 0,
  "evidence_is_simulated": true,
  "agents": [
    {
      "agent_id": "1b100eef-7880-503f-b858-804b0c34696a",
      "name": "Mangal Wholesale Seller Agent",
      "strategy_profile": "margin",
      "status": "active"
    }
  ]
}
